[
  {
    "id": "keepsake-ribbon",
    "effects": [
      {
        "target": "stats.spirit",
        "value": 1
      }
    ],
    "labelKey": "item.keepsake-ribbon.label",
    "descriptionKey": "item.keepsake-ribbon.description"
  },
  {
    "id": "worn-tools",
    "effects": [
      {
        "target": "stats.craft",
        "value": 1
      }
    ],
    "labelKey": "item.worn-tools.label",
    "descriptionKey": "item.worn-tools.description"
  },
  {
    "id": "cheap-primer",
    "effects": [
      {
        "target": "stats.mind",
        "value": 1
      }
    ],
    "labelKey": "item.cheap-primer.label",
    "descriptionKey": "item.cheap-primer.description"
  }
]
