[
  {
    "id": "cautious",
    "effects": [
      {
        "target": "money",
        "value": 1
      }
    ],
    "labelKey": "stance.cautious.label",
    "descriptionKey": "stance.cautious.description"
  },
  {
    "id": "ambitious",
    "effects": [
      {
        "target": "stats.social",
        "value": 1
      },
      {
        "target": "world.pressure",
        "value": 1
      }
    ],
    "labelKey": "stance.ambitious.label",
    "descriptionKey": "stance.ambitious.description"
  },
  {
    "id": "dutiful",
    "effects": [
      {
        "target": "relationship.all",
        "value": 1
      }
    ],
    "labelKey": "stance.dutiful.label",
    "descriptionKey": "stance.dutiful.description"
  },
  {
    "id": "rebellious",
    "effects": [
      {
        "target": "stats.spirit",
        "value": 1
      },
      {
        "target": "world.pressure",
        "value": 2
      }
    ],
    "labelKey": "stance.rebellious.label",
    "descriptionKey": "stance.rebellious.description"
  },
  {
    "id": "generous",
    "effects": [
      {
        "target": "money",
        "value": -2
      },
      {
        "target": "relationship.all",
        "value": 2
      }
    ],
    "labelKey": "stance.generous.label",
    "descriptionKey": "stance.generous.description"
  }
]
